{
  "schemaVersion": "quality-label.v1",
  "labelId": "b3b69e9a-657b-4356-83ed-5090a3ce3f85",
  "traceId": "7b6c25a9-e20d-4a1f-9a4f-84b29de2f1a8",
  "scenarioGroupId": "synthetic-ambiguous-0001",
  "telemetryBatchId": "d6a6e478-20d4-4608-89f1-7980c98844e0",
  "telemetrySchemaVersion": "telemetry-batch.v2",
  "labelState": "review_required",
  "label": null,
  "labelSource": "human_review",
  "confidence": null,
  "reviewReason": "speed and accuracy signals disagree",
  "labelGuideVersion": "quality-label-guide.v1",
  "labeledAt": "2026-08-11T09:05:00Z"
}
